Name|Breeder|Vendor|Characteristics|Similar|Adaptation|Resistance|Parentage
NorKing Russet (ND388-1 Russ)|Johansen et al., North Dakota State University.||medium-high yield of oblong, heavily russetted tubers; medium maturity, good for french fries and tablestock, medium tuber solids, long dormancy.||produced primarily in the western United States, Atlantic Canada, valid 1996. American Potato Journal 63:701. 1985.|common scab, verticillium wilt.|Nooksack x ND9567-2 Russ.
Norkota|USDA.||extinct; high yield of oblong, white tubers; good for tablestock. USDA Circ. 741, 1946. 1933.||||Rural New Yorker x Katahdin.
Norland (ND2906-1R)|Johansen et al., North Dakota State University.||medium-high yield of round, light red tubers, very early maturity, good for tablestock, low tuber solids, very short dormancy; two darker red mutants of Norland, Red Norland and Dark Red Norland are the predominant early red skinned cultivars in the United States, Canada.|||common scab. American Potato Journal 36:12. 1957.|RedKote x ND626.
NorQueen Russet (ND671-4Russ)|Johansen et al., North Dakota State University.||medium-low yield of oblong, flattened, heavily russetted tubers; early maturity, good for tablestock, low tuber solids, medium dormancy.||produced primarily in North Dakota, valid 1996. 1993.|common scab.|WN330-1 x ND9567-2Russ.
NorValley (ND2417-6)|Novy, North Dakota State University.||medium yield of round, white tubers; medium maturity, good for chips, medium tuber solids, capable of producing chips directly from cold storage.||produced primarily in the upper midwest of the United States, valid 1996. 1996.|common scab, hollow heart.|Norchip x ND860-2.
NorWis (FL657)|Cipar, Frito-Lay.||high yield of oblong, white tubers; medium-late maturity, good for chips, medium tuber solids, short dormancy.||produced primarily in the upper midwest of the United States, valid 1996. American Potato Journal 67:371. 1990.|PVX, PVY, pea leaf roll virus.|RD289-18 x Monona.
OAC Ruby Gold (G8160-11RY)|Ali-Khan et al., Ag. Canada, Ontario.||medium-high yield of oblong, red tubers with yellow flesh; medium maturity, good for tablestock, medium tuber solids, medium dormancy.||produced primarily in Ontario, valid 1996. American Potato Journal 73:301. 1994.|common scab, verticillium wilt.|Rhinered x Rose Gold.
OAC Temagami (G8160-6R)|Ali-Khan et al., Ag. Canada, Ontario.||not in production; medium-high yield of round, dark red tubers; medium maturity, good for tablestock, medium tuber solids, medium dormancy.|||moderate to common scab, verticillium wilt. American Potato Journal 73:305. 1994.|Rhinered x Rose Gold.
Oceania|Webb et al., USDA, University Florida, Virginia.||not in production; high yield of round, white tubers; medium maturity, good for tablestock.|||PVA, PVY. 1981.|DT5997-1R x B5283-5.
Ona|USDA, Beltsville, Maryland.||medium oblong tubers, white skin, shallow eyes.|Katahdin.|Minnesota, Maine, and Florida. American Potato Journal, 1962, 1961.|late blight, scab, and verticillium wilt and immune from mild mosaic.|USDA seedlings B3021-3 x B2968-31.
Onaway|Michigan State University, East Lansing.||upright vine; vigorous growth for early cultivar; best yielding early cultivar.|Irish Cobbler.|Bay Company, Michigan early potato regions.|common scab; field resistance to late blight.|Katahdin x B9G-56 (parentage of B9G-56 is 3895 x Earliana).
Oneida (W623)|Peloquin, University Wisconsin.||not in production. Badger Commentator 29:3. 1976.||||W285 x W231.
Ontario|Cornell University, Ithaca, New York, the USDA.||high yielding, white, oblong tubers, shallow eyes.||western New York and Wisconsin. American Potato Journal, 1946.|scab and late bright.|Richters Jubel x USDA 44537.
Oromonte (USDA 46125)|Twomey, USDA, Colorado State University.||extinct; medium-high yield of oblong, white tubers with yellow flesh; late maturity, good for chips.|||PVY. American Potato Journal 45:297. 1967.|USDA 43106 x Katahdin.
Osage|USDA, Beltsville, Maryland, and the Iowa Agric. Expt. Sta., Ames.|Ben Picha.|smooth, long tubers, midseason maturity, high quality, low set, tendency to hollow heart, long dormancy.||central and northeastern muck areas. American Potato Journal 31: 299-304, 1954.|scab.|USDA Seedling X245-186 x Katahdin.
Osseo|University of Minnesota, Institute of Agriculture, University Farm, Saint Paul.||extra early, white tubers, upright vine, uniform size of tubers.||short seasons and early market gardens. University of Minnesota Expt. Sta. Rpt., 19. 1952.||Cobbler x selection 56-1.
Pawnee|USDA, Colorado Potato Expt. Sta., Greeley.||good yield, good market quality.||Colorado. USDA Circ. 665, March, 1943.||Rural New Yorker 2 x Katahdin.
Peconic (NY1)|Peterson, Cornell University.||not in production; high yield of oval, white tubers; early-medium maturity, good for tablestock, medium tuber solids.|||golden nematode. American Potato Journal 43:450. 1966.|LNA-106 x Katahdin.
Peerless|Bresee, private.||extinct; high yield of round, white-splashed pink tubers; late maturity, good for tablestock. Potato Handbook, 1959. Potato Assoc. of Amer. 1962.||||open pollinated seedling of Garnet Chili.
Pele (35-5)|Ito, University Hawaii.||extinct; high yield of round, white tubers; late maturity, good for tablestock, medium tuber solids.|||late blight. American Potato Journal 55:573. 1978.|57-AH-9 x Anita.
Pennchip (PA4QV-30)|Mills, Pennsylvania State University.||not in production; medium-high yield of round, white tubers; late maturity, good for chips, low tuber solids, long dormancy.|||late blight, R-gene, PVA. American Potato Journal 41:54. 1963.|PA3RD-5 x PA3WH-9.
Pennigan|Pennsylvania State University, University Park.||obsolete.|Russet Rural.|same as Russet Rural. 1938.||Russet Rural x McCormick.
Pennrose|Mills, Pennsylvania State University.||not in production; tubers are round with red skin, good for tablestock. 1981.||||Norland x B4494-6.
Penobscot (B3563-2)|Simpson and Akeley, University Maine, USDA.||not in production; medium-high yield of oblong, white tubers; early-medium maturity, good for tablestock, chips, high tuber solids.|||PVA. American Potato Journal 41:140. 1963.|USDA X927-3 x Katahdin.
PHX 523|Ben Picha, Box 816, Grand Forks, North Dakota.|Ben Picha, Box 816, Grand Forks, North Dakota.||Russet Burbank.|wide. 1966.|scab.|B1396-2 x ND4096-1.
PHX 541|Ben Picha, Box 816, Grand Forks, North Dakota.|Ben Picha, Box 816, Grand Forks, North Dakota.||Katahdin.|wide. 1966.|scab and virus XI.|Ia 801-10 x B2368-4.
PHX 591|Ben Piclia, Box 816, Grand Forks, North Dakota.|Ben Piclia, Box 816, Grand Forks, North Dakota.||White Rose.|wide. 1966.|scab and viruses X and Y.|B1396-2 x ND4096-1.
Pink Pearl (S.J. 62 26-9)|Canada Department of Agric., St. Johns West, Newfoundland, Canada.||late maturity, red skin, white fleshed, long tuber.|Ultimus.|Newfoundland, Canada, 1970.|potato wart races 1, 2, and 6; blight; and blackleg.|Ultimus x Katahdin.
Pioneer|Miller and OKeefe, University Nebraska.||not in production; high yield of oblong, light red tubers; medium maturity, good for tablestock, french fries, medium tuber solids. American Potato Journal 40:81. 1963.||||MN113-1-45 x Nebraska 225.43-1.
Placid|Cornell University, Ithaca, New York.||yield equivalent to Katahdins, midseason maturity, tendency for rough tubers in some areas, almost a carrier for virus Y.||northeastern United States. American Potato Journal 24:319-336, 1947. 1946.|late blight.|ABX-6 x AFY-5; both are Solanum demissum derivatives.
Platte (Nebraska 4.56-9)|OKeefe and Werner, University Nebraska.||extinct; medium-high yield of round, white tubers; medium-late maturity, good for chips, tablestock, medium tuber solids, medium dormancy.|||common scab. American Potato Journal 42:361. 1965.|Redbake x Nebraska 29.47-2.
Plymouth|USDA, Beltsville, Maryland, and North Carolina State College, Raleigh.||medium maturity.|Mohawk.|Maine and tidewater areas of North Carolina and Long Island, 1956.|late blight and scab.|Mohawk x 96-56.
Pontiac|Michigan State College, East Lansing, and USDA.|Certified Seed Growers.|high yielding, red skin type.|Triumph.|Red River Valley, Michigan, and Minnesota. Michigan Agric. Expt. Sta. Bul. 21(3):1939.||Bliss Triumph x Katahdin.
Portage (CS7697-24)|Reeves et al., University Maine, Campbell Institute.||not in production; medium-high yield of oval, white tubers; early maturity, good for tablestock, low tuber solids, medium dormancy.|||late blight, R-gene, verticillium wilt, net necrosis caused by pea leaf roll virus. American Potato Journal 72:681. 1992.|Raritan x BR6831-5.
Potomac|University of Maryland and the USDA, College Park.|W. Deberry, Oakland, Maryland.|smooth skin, shallow eyes, late.||northeastern United States. American Potato Journal 22: 261-266, 1945. 1945.|late blight and tipburn.|Rural New Yorker x Katahdin.
Prestile (CS7635-4)|Reeves et al., University Maine, Campbell Institute.||not in production; high yield of round, white tubers; late maturity, good for tablestock, low tuber solids, long dormancy.|||PVX, net necrosis caused by pea leaf roll virus. American Potato Journal 71:89. 1991.|BR6293-12 x B5421-3.
Pride|Pratt, private.||extinct; medium yield of round, white tubers; early-medium maturity, good for tablestock, low tuber solids.|||common scab. American Potato Journal 46:88. 1968.|Sebago x Ag56.
Progress|Department of Hort. Agric. Expt. Sta., University of Nebraska, Lincoln.|Nebraska Certified Potato Growers Cooperative.|scab resistant tubers that have red skin color, do not crack at harvest time, medium to small size, average cooking quality.||regionally as a late crop in western irrigation areas. 1949.|common scab.|USDA 0183 x Minnesota 5-10-3-8.
Ptarmigan (F76080)|Lynch et al., Ag. Canada, Alberta.||medium yield of oval, white tubers; early maturity, good for chips, tablestock, low tuber solids, medium dormancy.||produced primarily in the western United States, western Canada, valid 1996. American Potato Journal 71:387. 1993.|moderate to early blight, common scab.|ND6993-13 x F59103.
Pungo|Virginia Truck Expt. Sta., Norfolk and USDA, Beltsville, Maryland||medium maturity, rapid growth.||Virginia and Maine. American Potato Journal 30:323-326, 1954.|late blight.|96-44 x 528-170.
Quaggy Joe (AF1470)|Reeves et al., University Maine.||medium-high yield of round, white tubers; medium maturity, good for tablestock, low tuber solids.||produced primarily in Maine, valid 1996. 1996.|net necrosis caused by pea leaf roll virus.|CS7589-8 x Portage.
Ranger Russet (A7411-2)|Pavek et al., USDA, University Idaho.||high yield of long, russet tubers; late maturity, good for french fries, tablestock, high tuber solids, medium dormancy.||produced primarily in the western United States, valid 1996. American Potato Journal 69:483. 1991.|PVY, verticillium wilt, fusarium tuber rot, hollow heart, net necrosis caused by pea leaf roll virus; immune to PVX.|Butte x A6595-3.
Raritan (F54059)|Campbell and Young, Rutgers University.||not in production; high yield of oblong, lightly russetted tubers; medium-late maturity, good for chips, high tuber solids.|||PVX, PVA, late blight, R-gene. American Potato Journal 47:264. 1970.|F45019 x SSRBP834C (29).
Red Beauty|University of Wisconsin, Madison.|Starks Farms.|upright growth habit; medium season; smooth, bright red tubers.|Triumph.|midwestern United States. American Potato Journal 32:346-349, 1955.|verticillium wilt.|NDI x Cayuga.
Red Cloud (Nebraska A143.70-2)|OKeefe et al., University Nebraska.||medium yield of oval, dark red tubers; medium maturity, good for tablestock, medium tuber solids, very long dormancy.||produced primarily in Nebraska, southwest United States, valid 1996. American Potato Journal 70:301. 1992.|common scab, verticillium wilt, early blight.|Nebraska 185.70-1 x Superior.
Red Gold (G7015-11RY)|Coffin et al., Ag. Canada, Ontario.||not in production; medium yield of round, red tubers with yellow flesh; early-medium maturity, good for tablestock, medium tuber solids, short dormancy.|||common scab. American Potato Journal 65:49. 1987.|G68211 x G6521-4RY.
Red LaSoda|Webb and Miller, USDA, Louisiana State University.|Certified Seed Growers.|more intense skin coloration than LaSoda; otherwise identical.|LaSoda.|south and early northern areas. American Potato Journal 31:40, 1954. 1953.||red skinned sport of LaSoda.
Red McClure|private institution.||not in production; high yield of oblong, red tubers; late maturity, good for tablestock. USDA Circ. 741, 1946. 1910.||||red skinned sport of Improved Peachblow.
Red Norland -||Similar:|see Norland.|Resistance:|produced throughout the United States, Canada, valid 1996.|Parentage:|Parentage
Red Pontiac -||Similar:|see Pontiac, used as a garden cultivar throughout the United States, Canada, valid 1996.|Resistance:||Parentage:|Parentage
Red Ruby (MN13035)|Lauer, University Minnesota.||||||Bison x MN11.76-1. 1994.
Red Warba|Minnesota Agric. Expt. Sta., Saint Paul.||extra early, round, red type; short season adaptation, or for early market use. American Potato Journal 16:7.||||mutation from Warbs.
Redbake (Nebraska 2644-1)|Werner, University Nebraska.||extinct; tubers are round with red skin, medium maturity, good for tablestock, chips, high tuber solids. Potato Handbook, 1959. Potato Assoc. of Amer. 1956.||||Nebraska 10.42-1 x Nebraska 1.41-2.
Redburt|Obert Grover, Glyndon, Minnesota, and University of Minnesota, Saint Paul.||smooth, red skinned; high yield.|LaSoda.|wide. American Potato Journal 30:8, 1953.||Satapa sport.
Reddale (MN8757)|Lauer, University Minnesota.||high yield of round, red tubers; medium maturity, good for tablestock, low tuber solids.||produced primarily in Minnesota, valid 1996. Potato Varieties in Canada, 1991. New Brunswick Department of Agric. 1984.|common scab, verticillium wilt, late blight, R-gene.|Erik x Chieftain.
Redglo|Department of Hort., University of Nebraska, Agric. Expt. Sta., Lincoln.|selected seed growers in western Nebraska.|dark red tubers, medium to large, medium to late, intermediate dry matter.||western Nebraska, late crop irrigated and dry land. 1954.||segregate from North Dakota cross 176 (Pontiac x 11-1-3-2) x Nebr. 49.40-2 (Minnesota 5-10-3-23-2 x Minnesota 29.32-1-34).
Redkote|Ben Picha, Grand Forks, North Dakota.|Ben Picha, Grand Forks, North Dakota.|rosy red color, very smooth, high uniformity of tubers without oversize.|Red Pontiac.|mid-central states.|internal browning, scab resistant.|116-10 x Pontiac (116-10 is 528-229).
Redsen (ND146-4R)|Johansen et al., North Dakota State University.||medium-high yield of round, dark red tubers; early-medium maturity, good for tablestock, low tuber solids, short dormancy.||produced in limited locales throughout the United States, Canada, valid 1996. American Potato Journal 61:549. 1983.|common scab, late blight, R-gene, very susceptible to storage rots.|ND8978-3R x ND9403-20R.
Redskin|USDA, Beltsville, Maryland.|USDA and Texas Agric. Expt. Sta., College Station, Texas.|high yield, red skin, late maturity.||wide. 1960.|scab, virus A, net necrosis from leaf roll.|Pontiac x USDA seedling B400-1.
Reliance (F29-1)|USDA.|Ben Picha, Grand Forks, North Dakota.|early as Clobber, high yielding and delayed sprouting.||wide. 1963.|late blight, scab, X immune.|early Gem x Tawa.
Rhinered (W729R)|Peloquin, University Wisconsin.||not in production; medium yield of round, red tubers; early-medium maturity, good for tablestock, medium tuber solids.|||common scab, verticillium wilt. Potato Varieties in Canada, 1991, New Brunswick Department of Agric. 1981.|W639 x Norchief.
Rideau (G6457-5R)|Johnston and Rowberry, Ag. Canada, Ontario.||medium-high yield of round red tubers; late maturity, good for tablestock, low tuber solids.||produced primarily in Atlantic Canada, valid 1996. American Potato Journal 57:47. 1971.|verticillium wilt, common scab.|Viking x Picha 177-13R.
Rosa (NY61)|Plaisted et al., Cornell University.||not in production; high yield of oval, white-splashed pink tubers; late maturity, good for chips, tablestock, medium tuber solids, medium dormancy.|||golden nematode, late blight, R-gene. American Potato Journal 58:451. 1981.|Wauseon x J171-8Adg.
Rose Gold (G7010-19RY)|Coffin et al., Ag. Canada, Ontario.||not in production; medium yield of round, red tubers with yellow flesh; medium-late maturity, good to tablestock, medium tuber solids, medium dormancy.|||common scab. American Potato Journal 65:325. 1988.|Abnaki x G6521-4RY.
Rukat|W.P. Raleigh, Clyde, Kansas.|Arthur J. Pratt.|purple in stems, rural type foliage.|Rural. 1954.||misshapen tubers, susceptible to hollow heart and scab.|Russet Rural x Katahdin.
Rural New Yorker|Carman, private.||extinct; high yield of oblong, white tubers; late maturity, good for tablestock. USDA Circ. 741, 1946. 1988.||||
Rushmore|Louisiana State University, Baton Rouge.|Melvin Rominsky, Rhinelander, Wisconsin.|bright russet color; an oblong, flat potato, sprouts green.|Burbank.|northern tier of United States to south if irrigated. American Potato Journal January or February, 1957.||Katahdin x Green Mountain.
Russet Arenac|Thompson, University Michigan.||not in production; see Arenac. 1965.||||russetted sport of Arenac.
Russet Bake-King|Lawrence, Cornell University.||not in production; see Bake-King. American Potato Journal 71:127. 1994.||||russetted sport of Bake-King.
Russet Burbank|Sweet, private.||the predominant cultivar in the United States and Canada for tablestock, french fries, see Burbank for more information. USDA Circ. 741, 1947. about 1917.||||russetted sport of Burbank.
Russet Norkotah (ND1534-4Russ)|Johansen et al., North Dakota State University.||medium-low yield of long, russet tubers; very early maturity, good for tablestock, low tuber solids, medium dormancy, most prominent of the early russet tablestock cultivars, valid 1996.||produced throughout the United States, Canada, valid 1996. American Potato Journal 65:597. 1987.|common scab, very susceptible to verticillium wilt.|ND9526-4Russ x ND9687-5Russ.
Russet Nugget (TC582-1)|Holm et al., Colorado State University, Texas A and M University.||medium-high yield of long, flattened, heavily russetted tubers; late maturity, good for tablestock, french fries, high tuber solids, medium dormancy.||produced primarily in Colorado, valid 1996. American Potato Journal 69:331. 1989.|common scab, verticillium wilt, early blight.|Krantz x AND71609-1.
Russet Rural|unknown.||see Rural New Yorker. USDA Circ. 741, 1946.||||Unknown.
Russet Sebago|University of Wisconsin, Madison.||russet tuber.|Sebago.|north central adaptation, 1947.|common scab and late blight.|clonal selection out of Sebago.
Russette (B7583-6)|Webb et al., USDA, University Maine, others.||not in production; high yield of oblong, russet tubers; late maturity, good for tablestock, french fries, medium tuber solids, long dormancy.|||verticillium wilt, pinkeye, heat necrosis; immune to PVA, necrosis caused by pea leaf roll virus. American Potato Journal 61:77. 1981.|B5141-6 (Lenape) x WN245-2.
Sable (F5653)|Davies et al., Ag. Canada, New Brunswick.||not in production; high yield of oblong, white tubers; early maturity, good for tablestock, low tuber solids.|||common scab. American Potato Journal 43:154. 1964.|F52094 x F47024.
Saco|USDA, Beltsville, Maryland, and the Maine Agric. Expt. Sta., Orono.||high yield and dry matter content, more rough than some new cultivars.|Green Mountain and Kennebec. American Potato Journal, 1955.||immune from virus X, mild mosaic, and common race of late blight fungus; possibly immune to net necrosis.|USDA seedlings 41956 x X96-56.
Saginaw Gold (MS002-171Y)|Coffin et al., Ag. Canada, University Michigan, others.||not in production; medium yield of oblong, white tubers with yellow flesh; medium maturity, good for tablestock, chips, medium tuber solids. American Potato Journal 66:303. 1988.||||MS321-38 x Michibonne.
Sangre (AC67560-1)|Twomey et al., Colorado State University USDA.||high yield of oval, red tubers; medium maturity, good for tablestock, medium tuber solids, long dormancy.||produced primarily in Colorado. American Potato Journal 59:435. 1982.|net necrosis caused by pea leaf roll virus, hollow heart.|Viking x A6356-9.
Saranac (USDA X336-144)|Stevenson and Livermore, USDA, Cornell University.||extinct; tubers round and white, late maturing, good for tablestock.|||ring rot. American Potato Journal 26:45. 1949.|President x Katahdin.
Satapa|Minnesota Agric. Expt. Sta., Saint Paul.||medium-early, red, exceptionally round, smooth tubers, upright vine.||general. American Potato Journal 26(7), 1949.|in field to virus X.|Red Warba x 20-4.
Sebago|USDA.||good market and cooking quality.||Florida, Alabama, South Carolina. USDA Cir. 503, November, 1938.|late blight, mild mosaic, net necrosis, yellow dwarf.|Chippewa x Katahdin.
Seminole (B4469-7 or FL282)|Stevenson et al., Frito-Lay.||extinct; medium-high yield of round, white tubers; early-medium maturity, good for chips, high tuber solids.|||verticillium wilt. American Potato Journal 47:35. 1969.|Delta Gold x B3672-3.
Seneca|Cornell University Ithaca, New York.||high yield, tendency to be rough and produce tubers in chains.||central New York. American Potato Journal 23:315-329, 1946. 1945.|scab and some field resistance to fusarium wilt and late blight.|Hindenburg x Katahdin.
Sequoia|North Carolina Agric. Expt. Sta., Raleigh, N.C., and the USDA.||white tubers, high yielding, good market quality.||North Carolina and Tennessee. American Potato Journal April, 1945.|late blight, leaf hopper burn, flea beetle injury.|Green Mountain x Katahdin.
Shasta (SH-1)|Groza, private.||not in production; high yield of long, white tubers; late maturity, good for french fries, tablestock, medium tuber solids, short dormancy.|||verticillium wilt, early blight. Potato Varieties in Canada, 1991, New Brunswick Department of Agric. 1990.|A69656-4 x WNC214-36.
Shepody (F69016)|Young et al., Ag. Canada, New Brunswick.||high yield of long, white tubers; early-medium maturity, good for french fries, medium tuber solids, medium dormancy.|||net necrosis caused by pea leaf roll virus, predominant cultivar for early harvest french fry production in the United States, Canada, valid 1996. American Potato Journal 60:109. 1980.|Bake-King x F58050.
Sheridan|Department of Hort., Agric. Expt. Sta., University of Nebraska, Lincoln.|Department of Hort., Agric. Expt. Sta., University of Nebraska, Lincoln.|medium red, round, early tubers of good culinary quality, much smoother and higher dry matter than Red Warba; proven in late irrigation area of western Nebraska. 1953.||||Triumph (Nebraska Str. 22) x Nebraska 49.40-3 (Minnesota 5-10-3-23-2 x Minnesota 29. 32-1-34).
Shoshoni (A175-7)|Sanford et al., USDA, University Idaho.||not in production; medium yield of round, white tubers; late maturity, good for tablestock, medium tuber solids.|||common scab. American Potato Journal 41:95. 1963.|Early Gem x B2913-24.
Shurchip (Nebraska 1655-1)|OKeefe, University Nebraska.||high yield of round, lightly russetted tubers; medium maturity, good for chips, medium tuber solids, medium dormancy.||produced primarily in Nebraska, valid 1996. American Potato Journal 47:124. 1969.|common scab.|Nebraska 226.49-1X x Nebraska 25.47-7x.
Sierra (AD7377-1)|Voss and Pavek, University California, USDA.||not in production; high yield of oblong, russet tubers; medium maturity, good for tablestock, low tuber solids.|||common scab, net necrosis caused by pea leaf roll virus, hollow heart, growth cracks. University California, Research Reviews 17, 1986. 1987.|A66110-39 x Targhee.
Simcoe (G6880-1)|Johnston and Rowberry, Ag Canada, Ontario.||not in production; medium yield of round, white tubers; late maturity, good for tablestock, chipping, medium tuber solids.|||PVA, late blight, R-gene, net necrosis caused by pea leaf roll virus. American Potato Journal 59:39. 1981.|Peconic x B5141-6 (Lenape).
Sioux (Nebraska 20257-1)|OKeefe, University Nebraska.||extinct; medium-high yield of round, red tubers; medium maturity, good for tablestock, medium tuber solids, medium dormancy.|||common scab. American Potato Journal 47:163. 1969.|Nebraska 240.54-1 x Nebraska 90.49-1X.
Snowchip (AK35)|Dearborn, University Alaska.||not in production; medium yield of oval, white tubers; medium-late maturity, good for chips, high tuber solids. American Potato Journal 52:47. 1973.||||Ontario x Stately.
Snowden (W855)|Peloquin, University Wisconsin.||medium-high yield of round, white tubers; late maturity, good for chips, high tuber solids, medium dormancy.|||moderate to common scab, produces acceptable chips follow cold storage, predominant storage chipping cultivar since 1993, valid 1996. Potato Varieties in Canada, 1991. New Brunswick Department of Agric. 1990.|B5141-6 (Lenape) x Wischip.
Snowdrift|Cornell University, Ithaca, New York.||early maturity, smooth tubers.||central New York. American Potato Journal 27:1-10, 1950. 1947.|late blight.|ATY-4 x Earlaine.
Snowflake (ND 3324-2)|North Dakota State University.||early, high specific gravity.|Kennebec. American Potato Journal vol. 40 August, 1963 and North Dakota Farm Res. vol. 21, 1961.||virus Y in field.|Kennebec x ND 457-1.
Somerset (AF236-1)|Reeves et al., University Maine, University Pennsylvania.||medium-high yield of oblong, white tubers; medium maturity, good for chips, medium tuber solids, medium dormancy.||produced primarily in the northeastern United States, valid 1996. American Potato Journal 67:153. 1988.|early blight, late blight, R-gene.|B6097-9 x B6516-5.
Spartan Pearl (MS700-83)|Douches et al., Michigan State University.||not in production; high yield of round, white tubers; medium maturity, good for tablestock, medium tuber solids, medium dormancy. American Potato Journal 69:785. 1991.||||Atlantic x Michibonne.
