Name|Breeder|Vendor|Characteristics|Similar|Adaptation|Resistance|Parentage
St. Johns (AF828-5)|Reeves, University Maine.||medium-high yield of round, white tubers; late maturity, good for tablestock.||produced primarily in Maine, valid 1996. 1993.|golden nematode, corky ringspot.|BR6317-21 x CC14-3A.
St. Louis|G.A. Johnson, Hermantown, Minnesota.|G.A. Johnson, Hermantown, Minnesota.|probably no longer available. 1943.||||
Stately (A-43-10)|Dearborn, Alaska Agr. Expt. Sta., Palmer.||extinct; low yield of round, white tubers; late maturity, good for tablestock, high tuber solids, released as a home garden cultivar for Alaska; high dry matter, excellent baking or mashing.|Alaska 114. American Potato Journal 38:244. 1961.|||Alaska 114 x X792-94.
Steuben (NY81)|Plaisted et al., Cornell University.||not in production; high yield of oblong, white tubers; medium maturity, good for tablestock, chips, medium tuber solids, long dormancy.|||golden nematode. American Potato Journal 67:239. 1989.|F9-31 x GN bulk pollen.
Suncrisp (B9792-8B)|Haynes et al., USDA, University Florida, others.||not in production; medium-high yield of oval, lightly russetted tubers; late maturity, good for chips, high tuber solids.|||golden nematode, common scab, PVY, heat necrosis. 1993.|Wauseon x B5141-6 (Lenape).
Sunrise (CF7358-14)|Reeves et al., University Maine, Campbell Institute.||high yield of round, white tubers; early maturity, good for tablestock, field delivery chip production, low-medium tuber solids, medium dormancy.||produced primarily in northeastern United States, Atlantic Canada, valid 1996. American Potato Journal 62:221. 1985.|golden nematode, PVX, net necrosis caused by pea leaf roll virus.|Wauseon x B6563-2.
Superior (AG29)|Rieman, University Wisconsin.||medium yield of round, white tubers; early maturity, good for tablestock, field delivery chip production, low-medium tuber solids, short dormancy.||produced throughout the midwestern, eastern regions of the United States, Canada, valid 1996. American Potato Journal 39:19. 1961.|common scab, predominant early maturing, round white tablestock cultivar.|USDA X96-56 x MN59.44.
Targhee (A6334-19)|Pavek et al., USDA, University Idaho.||not in production; high yield of oblong, russet tubers; late maturity, good for tablestock, french fries, medium tuber solids, medium dormancy.|||rhizoctonia, common scab, verticillium wilt, PVX, storage rots, hollow heart, growth cracks. American Potato Journal 50:293. 1973.|Norgold Russet x A463-4.
Tawa|Iowa State College, Ames.|Ben Picha and Starks Farms.|early as Irish Cobbler, very smooth and uniform, never tough, high quality.||all northern potato growing areas. 1957.|scab, late blight, virus X immune.|B595-76 x B76-23.
Tejon (NDD47-1)|Voss, University California.||high yield of long, white tubers; late maturity, good for tablestock, medium tuber solids, long dormancy.||produced primarily in California, valid 1996. University California Research Reviews 17, 1986. 1987.|storage rots, verticillium wilt, early blight.|B7583-9 x AF10-8.
Teton|Maine Agric. Expt. Sta., Orono, and the Wyoming Agric. Expt. Sta., Laramie, and the USDA.||white tuber, round to oblong, high yield, good market and cooking quality.||Maine, New York, and Wyoming. American Potato Journal November, 1946.|mild mosaic and ring rot.|USDA seedling 45146 x Earlaine.
Tobique (F61025)|Davies et al., Ag. Canada, New Brunswick.||not in production; high yield of oblong, white-purple splashed tubers; early maturity, good for chips, low tuber solids.|||verticillium wilt, fusarium tuber rot, PVY, net necrosis caused by pea leaf roll virus. American Potato Journal 54:419. 1977.|F45019 x Cariboo.
Tolaas (MN7973)|Lauer, University Minnesota.||not in production; high yield of long, white tubers; medium-late maturity, good for tablestock, french fries, medium tuber solids, long dormancy.|||common scab, late blight, hollow heart. Potato Varieties in Canada, 1991, New Brunswick Department of Agric. 1984.|Shurchip x MN1106.64-1.
Trent (G6549-7)|Johnston and Rowberry, Ag. Canada, Ontario.||not in production; medium yield of round, white tubers; early-medium maturity, good for tablestock, chips, medium-high tuber solids.|||PVY, common scab, late blight, R-gene, net necrosis caused by pea leaf roll virus. American Potato Journal 56:211. 1978.|Nordak x B5141-6 (Lenape).
Triumph|Bliss, private.||extinct; high yield of round, red tubers; early-medium maturity, good for tablestock, historically an important cultivar. USDA Circ. 741, 1946. 1978.||||Peerless x Early Rose.
Ute Russet (WNC285-18)|Holm et al., Colorado State University.||medium yield of oblong, flattened, heavily russetted tubers; late maturity, good for tablestock, medium tuber solids, long dormancy.||produced primarily in Colorado, California, valid 1996. American Potato Journal 64:559. 1987.|sclerotinia, net necrosis caused by pea leaf roll virus, verticillium wilt, common scab.|WN12-3 x Nooksack.
Viking (ND 3815-IR)|North Dakota University, Fargo.||red skin, high yield and quality.|Red Pontiac. North Dakota Farm Research 22(9) January, 1963. 1962.||drought.|Redskin x ND 457-1.
Virgil|Cornell University, Ithaca, New York.||late, heat tolerant.||central New York. American Potato Journal 24:319-336, 1947. 1946.|late blight.|ZH-2 x 15-2, ZH-2 Solanum demissum derivative, 15-2 Krantz seedling.
Waimea (25S)|Sekioka et al., University Hawaii.||extinct; high yield of oval, white tubers; late maturity, good for tablestock, medium tuber solids.||high elevation areas of Hawaii. American Potato Journal 51:229. 1972.||57-AH-9 x Anita.
Warba (MN51-16)|University Minnesota.||high yield of round, white tubers; early maturity, good for tablestock, low tuber solids, a red skinned sport of this cultivar was released and grown as Red Warba.||produced primarily in Atlantic Canada. Minnesota Horticulture 61:137. 1933.|PVA.|Triumph x MN4-16.
Waseca|Minnesota Agric. Expt. Sta., Saint Paul.||extra early, red, good market and table qualities.||regions of short seasons, for early market, on peat land. American Potato Journal 26(7), 1949.||Bliss Triumph x 15-2-10.
Wauseon (B5036-40)|Cunningham et al., Campbell Institute, USDA, Cornell University.||not in production; high yield of round, white tubers; medium-late maturity, good for chips, tablestock, medium tuber solids.|||PVA, PVX, golden nematode, common scab, net necrosis caused by pea leaf roll virus, good canning quality. American Potato Journal 45:146. 1967.|B5149-8 x Katahdin.
White Cloud|Department of Hort., Nebraska Agric. Expt. Sta., Lincoln.|Nebraska Certified Seed Potato Growers Cooperative.|unusual uniformity in shape and size, white tubers, heavy set, high dry matter; suitable generally as an early white potato. 1949.||||Warba x Katahdin.
White Gold (Kramers Early White Gold)|G.F. Kramer, Grand Rapids, Minnesota.|Arrowhead Potato Growers Association, Grand Rapids, Minnesota.|open pollinated very early; high yielding, smooth white potato of excellent quality.|Green Mountain.|wide. 1937.|blight, mosaic.|Green Mountain seed.
White Rose|Chapman, private.||high yield of long, white tubers, deeper eyes, late maturity, good for tablestock, medium tuber solids, long dormancy.||produced primarily in California, valid 1996. Potato Handbook, 1959. Potato Assoc. of Amer. 1993.||Uncertain.
Wischip (W629)|Peloquin, University Wisconsin.||medium-high yield of round, white tubers; good for chips.||produced primarily in Nebraska. 1974.||W55-306-58 x W231.
Wyred (WY2850)|Riedl, University Wyoming.||extinct; high yield of round, red tubers; medium-late maturity, good for tablestock, medium tuber solids.|||common scab. American Potato Journal 45:33. 1968.|Nebraska 127.47-5 x Katahdin.
Yampa|Colorado Agric. Expt. Sta., Fort Collins, and the USDA.|Certified Seed Service.|scab resistance, white, second early, growth crack susceptibility on heavy soils.|Katahdin.|sandy soil areas. American Potato Journal, September, 1949.||
Yankee Chipper (AF205-9)|Reeves et al., University Maine.||not in production; high yield of round, white tubers; medium maturity, good for chips, medium tuber solids, short dormancy.|||golden nematode, PVX, net necrosis caused by pea leaf roll virus. American Potato Journal 61:287. 1983.|Chipbelle x BR6864-8.
Yankee Supreme (CC26-1A)|Reeves et al., University Maine, Campbell Institute.||not in production; medium yield of oblong, white tubers; medium-late maturity, good for tablestock, medium tuber solids, medium dormancy.|||PVX, net necrosis caused by pea leaf roll virus. American Potato Journal 61:683. 1983.|Katahdin x BR6491-7.
York|Canada Department of Agric., Guelph, Ontario.||early maturing, white skinned, high total solids.||organic soils of Ontario, Canada American Potato Journal 47(6), 1970.|field immunity to virus X and common races of late blight; tolerance to common scab and rhizoctonia.|F5348 (Fredericton) x F5569 (Fredericton).
Yukon Gold (G6666-4Y)|Johnston and Rowberry, Ag. Canada, Ontario.||medium-high yield of oval, white tubers, with yellow flesh; early-medium maturity, good for tablestock, medium specific gravity, short dormancy, this cultivar is currently (1996) the predominant yellow-fleshed specialty potato, produced in small amounts throughout North America.|||PVA. American Potato Journal 58:241. 1980.|Norgleam x W5279-4.
