Name|Breeder|Vendor|Characteristics|Similar|Adaptation|Resistance|Parentage
Abnaki|Akeley, Murphy, Cetas, USDA; and Correll, U. Maine.||not in production; high yield of white, round tubers; late maturity, good for tablestock, medium tuber solids.||northeast United States. American Potato Journal 47:229. 1970.|verticillium wilt, leafroll induced net necrosis.|USDA X1276-185 x B4116-2.
AC Belmont (F70021)|Tarn, Ag. Canada, New Brunswick.||medium-high yield of round, white tubers; early maturity, good for tablestock, low tuber solids, short dormancy.||produced primarily in Atlantic Canada, valid 1996. American Potato Journal 72:409. 1988.|fusarium tuber rot.|Raritan x F51013.
AC Blue Pride (N1522-8)|K.G. Proudfoot, Agr. Canada, Newfoundland.|Provincial Government Seed Farm, Glenwood, Newfoundland.|medium high yield of long, blue-purple tubers; midseason maturity, good for tablestock.||Newfoundland conditions.|Potato Wart Disease.|N713-16 x N889-78-3.
AC Brador (F73008)|Tarn, Ag. Canada, New Brunswick.||not in production; medium yield of oblong, white tubers with yellow flesh; late maturity, good for tablestock or french fries, high tuber solids, long dormancy, bred for export.|||late blight, verticillium wilt, early blight; tolerance to pea leaf roll virus. American Potato Journal 72:401. 1991.|F61101 x F60034.
AC Chaleur|Tarn, Ag. Canada, New Brunswick.||medium-high yield of round, white tubers; medium-early maturity, good for tablestock, low tuber solids, medium dormancy.||produced primarily in Atlantic Canada, valid 1996. American Potato Journal 72:393. 1988.|PVY.|Belleisle x N457.
AC Domino (N1051-1)|Proudfoot, Ag. Canada, Newfoundland.||not in production; high yield of round, purple tubers; late maturity, good for tablestock, high tuber solids, medium dormancy.|||golden nematode, moderate-late blight. Potato Varieties in Canada, 1991. New Brunswick Department of Agric. 1990.|Blue Mac x SVP AM66-42.
AC Novachip (F77087)|DeJong, Ag. Canada, New Brunswick.||medium-high yield of oblong, white tubers; medium maturity, good for tablestock, potato chips, medium tuber solids, medium dormancy.||produced primarily in Atlantic Canada, northeastern United States, valid 1996. American Potato Journal 72:417. 1990.|common scab.|F68061 x F66011.
AC Pink Pearl (SJ62.26-9)|K.G. Proudfoot, Agr. Canada, Newfoundland.|Provincial Government Seed Farm, Glenwood, Newfoundland.|high yield of numerous oval pink skinned tubers; very late maturity; good for tablestock; long dormancy.||Newfoundland conditions.|Potato Wart Disease.|Ultimus x Katahdin.
AC Ptarmigan (F76080)|Lynch, Ag. Canada, Alberta.||medium yield of oval, lightly russetted tubers; early maturity, good for tablestock, chips, field delivery, low tuber solids, medium dormancy.||produced primarily in the prairie provinces of Canada, valid 1996. American Potato Journal 71:387. 1993.|common scab.|ND6993-13 x F59103.
Acadia Russet (F68036)|Tarn, Young, Ag. Canada, New Brunswick.||not in production; high yield of oblong, lightly russetted tubers; late maturity, good for tablestock, medium tuber solids, short dormancy.||maritime provinces of Canada. American Potato Journal 60:925. 1981.|fusarium tuber rot.|Bake-King x Norgold Russet.
Agassiz (MN8586)|Lauer, University Minnesota.||not in production; medium yield of oblong, russet tubers; late maturity, good for tablestock, chips, medium tuber solids, medium dormancy.|||common scab, hollow heart. Potato Varieties in Canada, 1991. New Brunswick Department of Agric. 1983.|MN321.64-11 x MN305.64-10.
Alamo (B5066-3)|Akeley, Perry, USDA, Texas A and M University.||not in production; medium-high yield of oblong, white tubers; medium-early maturity, good for tablestock, low tuber solids.|||late blight, R-gene, common scab, net necrosis caused by pea leaf roll virus. American Potato Journal 45:139. 1967.|Kennebec x Merrimack.
Alasclear (AK14-70-1-72)|Dearborn, USDA, University Alaska.||not in production; high yield of oblong, white tubers; late maturity, good for tablestock, high tuber solids, medium dormancy.|||common scab. American Potato Journal 60:189. 1981.|Ontario x AK1-62-90-64.
Alaska 114|Alaska Agric. Expt. Sta., Palmer.|Alaska Agric. Expt. Sta., Palmer.|medium vine type, tough white skin, stores well, good culinary characters.||Alaska. American Potato Journal 37:108-110, 1960.||Irish Cobbler x MN13-1.
Alaska Frostless (8-60-17-61)|Alaska Agric. Expt. Sta., Palmer.|Alaska Crop Improvement Association.|tops withstanding frosting to 28 ¬8F; tubers thin oval with faint purple blush on exposure to several days of light. American Potato Journal.||||Alaska 114 x 27-11.
Alaska Red (AK5)|Dearborn, University Alaska, USDA.||not in production; medium yield of oval, red tubers; medium maturity, good for tablestock, low tuber solids.||Alaska. American Potato Journal 54:365. 1976.||AK11-57-1-59 x Red Beauty.
Alaska Russet (AK47-44-1R)|Dearborn, University Alaska, USDA.||not in production; low yield of long, russet tubers; late maturity, good for tablestock, medium solids.|||common scab, susceptible to shatter cracking. American Potato Journal 41:137. 1963.|Columbia Russet x MN15-2.
Allagash Russet (AF193-4)|Reeves, Akeley, University Maine, USDA.||not in production; high yield of oblong, russet tubers; medium maturity, good for tablestock, chips, french fries, medium-low tuber solids.|||net necrosis caused by pea leaf roll virus, common scab. American Potato Journal 57:553. 1980.|BR7093-56 x B6024-3.
Characteristics: obsolete.|Adaptation: same as White Rural. 1939.|Similar:|Breeder: Pennsylvania State University, University Park.|Resistance:|White Rural cultivar.|Parentage: Russet Rural x McCormick.|Name: Allegheny Mountain
Allehanna|Pennsylvania Coop. Potato Growers.|Pennsylvania Coop. Potato Growers.|very early maturity, white, uniform smooth tubers, high solids, high yields.||Pennsylvania. American Agriculturist, 5 March 1960.||selected from undisclosed cross.
Anita|Rockefeller Foundation, Mexico City, Mexico.|Rockefeller Foundation, Mexico City, Mexico.|tubers round, light reddish color, white fleshed, high yields.||central Mexico. American Potato Journal 36:301, 1959.|late blight-field type.|seedling from self pollination of a selection of USDA Ace 25953 x USDA seedling B2131-3.
Anson|Proudfoot, Ag. Canada, Newfoundland.||not in production; high yield of round, white tubers; late maturity, good for tablestock, high tuber solids.|||moderate to late blight. Potato Varieties in Canada, 1991. New Brunswick Department of Agric. 1981.|F53018 x Mira.
Antigo|University of Wisconsin, Madison.|Wisconsin Certified Growers.|early to midseason maturity, tough tuber skin for mechanical harvesting.|Irish Cobbler.|North central. American Potato Journal 32:407-410, 1955.|scab.|Menominee x Wis. Seedling 302.44-6.
Arenac (IA1111-8)|Thompson, Iowa State University, Michigan State University, USDA.||extinct; medium-high yield of round, white tubers; late maturity, good for tablestock, chips, high tuber solids.|||common scab; immune to PVX. Potato Handbook, 1962, Potato Assoc. Amer. 1962.|B595-76 x IA872-4.
Ashworth|Cornell University, Ithaca, New York.||determinate growth, medium maturity, approximates Katahdin in yield, almost symptomless carrier for virus Y.||Northeast. American Potato Journal 24:319-336, 1947. 1946.|late blight.|CBP-1 x AQF-4, both parents Solanum demissum derivatives.
Atlantic (B6987-56)|Webb, Wilson, Shumaker, USDA, University Maine, University Florida.||high yield of round, scaly tubers; medium maturity, good for chips, high tuber solids, short dormancy, popular throughout the United States and Canada for chip production using direct-delivered potatoes, valid 1996.|||golden nematode, pink eye, net necrosis caused by pea leaf roll virus; immune to PVX. American Potato Journal 55:141. 1976.|Wauseon x B5141-6 (Lenape).
Avon (F4713)|Young, Ag. Canada, New Brunswick.||not in production; medium-high yield of oblong, white tubers; late maturity, good for tablestock, medium tuber solids.|||late blight, R-gene, common scab. American Potato Journal 39:363. 1958.|F1464-26 x USDA X96-56.
Bake-King (NY3)|R. Plaisted, Cornell.||high yield of oblong, white tubers; medium-early maturity, good for tablestock, high tuber solids, a russetted sport was released in 1994 (APJ, 71:127).||produced primarily in Alaska, valid 1996. American Potato Journal 44:287. 1967.|late blight, R-gene.|Merrimack x Green Mountain.
Batoche|Russel, Young, Ag. Canada, Saskatchewan.||not in production; medium yield of round, red tubers; medium maturity, good for tablestock, medium tuber solids.|||moderate to verticillium wilt. Potato Varieties in Canada, 1991. New Brunswick Department of Ag. 1976.|Scott 2774-3R x Redskin.
Beauty of Hebron|Coy, private.||open pollinated seedling; not in production; medium-high yield of oval, white-pink splashed tubers; early maturity, good for tablestock. USDA Circular 741, 1946. 1978.||||Garnet Chili.
Belchip (B6987-29)|Webb, Wilson, Shumaker, USDA, University Maine, University Florida.||not in production; high yield of round, white tubers; late maturity, good for chips, medium tuber solids, medium dormancy.|||race O of late blight, R-gene, heat necrosis; immune to PVA, PVX, net necrosis caused by pea leaf roll virus. American Potato Journal 57:61. 1979.|Wauseon x B5141-6 (Lenape).
Belleisle|Canada Department of Agric. Research Sta., Fredericton, N.B., Canada.|Canada Agriculture.|high specific gravity, bruise resistant, oval shape.||Atlantic region of Canada. American Potato Journal 52:51-55, 1975.|common scab, black wart, fusarium sambucinum.|SSRPB 834c(29) x F4724 (F47024).
Belrus (B7147-8)|Webb, Wilson, Shumaker, USDA, University Florida, University Maine.||medium-high yield of long, heavily russetted tubers; late maturity, good for tablestock, french fries, high tuber solids, medium dormancy.||produced primarily in Maine, Florida, valid 1996. American Potato Journal 58:111. 1978.|heat necrosis, northern root knot nematode, pinkeye; immune to PVA.|W245-2 x Penobscot.
Berita|Rockefeller Foundation, Mexico City, Mexico.|Rockefeller Foundation, Mexico City, Mexico.|medium maturity, smooth white tubers with white flesh.|||high field type to late blight. American Potato Journal 36:301, 1959.|seedling from a self pollination of a selection of USDA Ace 25953 x USDA Ace 25959.
Bison (ND6634-2R)|Johansen, North Dakota St. University.||not in production; medium yield of round, dark red tubers; medium maturity, good for tablestock, low tuber solids, medium dormancy.|||late blight race O, R-gene. American Potato Journal 54:189. 1974.|ND4652-4R x ND5124-1R.
Blanca|USDA, Greeley, Colo.|USDA and Colorado Agric. Expt. Sta., Fort Collins, Colo.|smooth white skinned, oval to slightly flattened tubers, medium maturity, good culinary and chipping qualities.|Katahdin.|Colorado. American Potato Journal 38:236-239, 1961.|scab.|USDA seedling x627-164 x USDA seedling B929-32.
Blue Mac|Proudfoot, Ag. Canada, Newfoundland.||not in production; high yield of round, purple tubers; late maturity, good for tablestock, medium tuber solids.|||moderate to late blight. Potato Varieties in Canada, 1991. New Brunswick Department of Agric. 1979.|Arran Victory x AND5-142.
Boone|North Carolina State College, Raleigh, and USDA, Beltsville, Maryland.||late maturity, excellent baker, and good keeper.|Sebago.|western areas of North Carolina. American Potato Journal 33:315-318, 1956.|late blight.|TI-5 x B231-3.
Bounty|Nebraska Agric. Expt. Sta., Lincoln.|Nebraska Agric. Expt. Sta., Lincoln.|high yielding red skinned cultivar higher in solids than Red Pontiac or Red La Soda.||Nebraska, 1960.||North Dakota-136 x Nebraska 217.43-1.
Brigus|Proudfoot, Ag. Canada, Newfoundland.||not in production; high yield of oval, purple tubers with yellow flesh; medium maturity, good for tablestock, medium tuber solids, very short dormancy.|||moderate to late blight, storage rots. Potato Varieties in Canada, 1991. New Brunswick Department of Agric. 1983.|G64-124-5p x SJ62-26-14.
Burbank|Burbank, private.||open pollinated seedling; high yield of long, white tubers; late maturity, good for tablestock, french fries, medium solids, long dormancy; the cultivar Russet Burbank is a sport of Burbank, has replaced it in production agriculture.|||common scab. USDA Circ. 741, 1946. 1976.|Early Rose.
Butte (A6371-2)|Pavek et al., USDA, University Idaho, Washington State University, Oregon State University.||high yield of long, russet tubers; late maturity, good for tablestock, french fries, medium tuber solids, medium dormancy, common garden cultivar, valid 1996.|||immune to PVX, net necrosis caused by pea leaf roll virus. American Potato Journal 65:685. 1977.|A492-2 x Norgold Russet.
Calgold (AD7267-1)|Voss, Pavek, University California, USDA.||not in production; high yield of long, lightly russetted tubers; late maturity, good for tablestock, medium tuber solids.|||verticillium wilt. University of California Research Reviews, 1986, Issue 17. 1987.|Butte x A6680-5.
Calrose (USDA 672-26)|Clark, USDA.||not in production; high yield of long, white tubers; late maturity, good for tablestock.|||late blight, R-gene. American Potato Journal 23:343. 1946.|Ackersegen x Katahdin.
CalWhite (A76147-2)|Voss, Pavek, University California, USDA.||very high yield of oblong, white tubers; medium-late maturity, good for tablestock, medium tuber solids, short dormancy, high in Vitamin C.||produced primarily in California, valid 1996. USDA Cultivar release notice, not dated. 1995.|fusarium tuber rot.|Pioneer x BC8370-4.
Campbell 11 (BR6863-3)|Nickeson, Campbell Institute.||not in production; high yield of round white tubers; maturity late, good for chips, medium tuber solids.|||golden nematode, late blight, R-gene, verticillium wilt. American Potato Journal 54:121. 1977.|Wauseon x B5141-6 (Lenape).
Campbell 12 (BR6626-5)|Nickeson, Campbell Institute.||extinct; high yield of oval, white tubers; late maturity, good for tablestock, medium tuber solids.|||late blight, R-gene. American Potato Journal 54:121. 1978.|Raritan x B5413-1.
Campbell 13 (BR6862-2)|Nickeson, Campbell Institute.||medium-high yield of oblong, white tubers; medium maturity, good for chips, medium tuber solids.||produced primarily in Maine, valid 1996. American Potato Journal 54:121. 1978.|late blight, R-gene, golden nematode, net necrosis caused by pea leaf roll virus.|Wauseon x B5042-2.
Campbell 14 (BR7093-23)|Reeves, Nickeson, University Maine, Campbell Institute.||not in production; high yield of round, white tubers; late maturity, good for tablestock, chips, medium tuber solids, medium dormancy.|||verticillium wilt, net necrosis caused by pea leaf roll virus. American Potato Journal 62:215. 1985.|BR5960-9 x ND5737-3.
Canoga|Plant Breeding Department, Cornell University Ithaca, New York.||good yielder, tubers keep shape, no net necrosis, mealy baker, does not slough when boiled, has fine flavor.|Smooth Rural.|northeastern United States. American Potato Journal 28:672-674, 1951.|leaf hoppers and tarnished plant bugs.|Albion x Katahdin.
Canso|Agric. Expt. Sta., Fredericton, New Brunswick, Canada.|Experimental Farm.|high starch content, very attractive tubers.|Katahdin.|eastern Canada. American Potato Journal 28:697-698, 1951. 1951.|common races of late blight.|(Solanum demissum x Earlaine x Katahdin x Katahdin x Katahdin x Katahdin) x Katahdin.
Canus|USDA, and Canada Department of Agric., Lacombe, Alta., Canada.||high yield, tubers round to oblong, white, medium early.||western Canada. American Potato Journal, 26:326-330, 1949.||Greeley seedling 9-11 x USDA seedling 24642.
Caribe (F69026)|Young, DeJong, Ag. Canada, New Brunswick.||medium-high yield of oblong, purple tubers; early maturity, good for tablestock, low tuber solids, medium dormancy.||produced in Atlantic Canada, valid 1996. American Potato Journal 61:281. 1981.|common scab.|F55066 x USDA X96-56.
Cariboo|Canada Department of Agric., Fredericton, N.B.||pink eyes with some pink splashing at eye end of tuber.||British Columbia, Canada. American Potato Journal 45:247-249, 1968.|phoma rot, verticillium wilt, common scab.|SSRPB 1256A (23) (Black) x K113-1 (Krantz).
Carlton (FS6222)|Russell et al., Ag. Canada, Saskatchewan, New Brunswick, Alberta.||medium yield of oblong, white tubers; early maturity, good for tablestock, low tuber solids.||prairie provinces of Canada, valid 1996. American Potato Journal 60:599. 1982.|PVX.|F47024 x F55069.
Cascade (WN48-1)|Hoyman, Washington State University.||high yield of oblong, white tubers; medium maturity, good for tablestock, french fries, medium tuber solids.||produced primarily in the upper midwest of the United States, valid 1996. American Potato Journal 47:261. 1969.|net necrosis caused by pea leaf roll virus, verticillium wilt.|B3820-14 x PI 214372.
Castile (B7592-1)|Webb, Sieczka, USDA, Cornell University.||high yield of oblong, white tubers; late maturity, good for tablestock, french fries, medium tuber solids.||produced primarily in New York, valid 1996. American Potato Journal 68:453. 1991.|golden nematode, corky ringspot, pinkeye, fusarium tuber rot.|Peconic x F107-30.
Catoosa (TL6279)|Dykstra; USDA, University Tennessee, Louisiana State University.|USDA Louisiana Agric. Expt. Sta., Baton Rouge and Tennessee Agric. Expt. Sta., Knoxville.|extinct; high yield of oval, red tubers; medium maturity, good for tablestock, low tuber solids.|Pontiac.|southern states. American Potato Journal 38:300-303, 1961.|common scab, late blight, R-gene.|seedling selection from TL 1859 selfed TL 1859 is derived from cross of Red Pontiac x USDA-seedling X96-56.
Cayuga|USDA, Beltsville, Maryland and Cornell University, Ithaca, New York.||russet skin, shallow eyes, high quality.||regionally, central New York. American Potato Journal 23:315-329, 1946. 1945.|scab and some resistance to fusarium wilt, late blight.|Hindenburg x Katahdin.
Centennial Russet (WNC285-146)|Twomey, Hoyman, Colorado State University, USDA.||medium yield of oblong, heavily russetted tubers; medium maturity, good for tablestock, medium tuber solids, long dormancy.||produced primarily in Colorado, southern California, valid 1996. American Potato Journal 54:603. 1976.|fusarium tuber rot.|Nooksack x WN12-3.
Century Russet (A74212-1E)|Mosley, Pavek, Oregon State University, USDA.||high yield of long, russet tubers; late maturity, good for tablestock, medium solids, medium dormancy.||produced primarily in Oregon, Texas, valid 1996. 1995.|verticillium wilt, common scab.|A6789-7 x A6680-5.
Chenango|Cornell University, Ithaca, New York.||early maturity, tubers smoother than Irish Cobbler.||restricted to valleys in central New York. American Potato Journal 24:331-335, 1947. 1946.|late blight.|United States seedling 46110 x BXS-1, BXS-1 Solanum demissum derivative.
Cherokee|USDA, Beltsville, Maryland; released jointly by USDA, Iowa State College, and Purdue University.||medium early.||muck soils of Iowa, Indiana, and Minnesota. American Potato Journal 31:53-58, 1954. 1953.|scab, late blight, mild mosaic, net necrosis.|USDA seedling 96-56 x USDA 528-170.
Chieftain (Ia 57410-10)|Iowa State University, Ames.|Certified Potato Seed Growers.|oval shaped tubers with less depth than width; bright red skin color.||north central and southern United States. American Potato Journal 45:293-296, 1968.|moderate to scab and moderate field resistance to late blight.|La 1354 x Ia 1027-18.
Chinook (F4775)|Canada Agric. Research Sta., Lethbridge, Alberta, and Fredericton, N.B., Canada.|Res. Sta., Lethbridge.|feathered to lightly russetted skin, midseason maturity, good cooking and processing quality.||irrigated areas of western Canada. American Potato Journal 43:1-5, 1966.|common scab.|USDA X96-56 x Menominee.
Chipbelle (B6987-148)|Webb, USDA, University Florida, Michigan State University.||medium yield of round, white tubers; late maturity, good for chips, not in production. 1981.||||Wauseon x B5141-6 (Lenape).
Chipeta (AC80545-1)|Holm, Pavek, Colorado State University, USDA, University Idaho.||high yield of round, white tubers; late maturity, good for chips, high tuber solids, long dormancy.||produced primarily in the western United States, valid 1996. 1993.|verticillium wilt, net necrosis caused by pea leaf roll virus, early blight.|WNC612-13 x Wischip.
Chippewa (USDA 42672)|Clark, USDA.||high yield of oblong, white tubers; early maturity, good for tablestock, chips, low tuber solids.||muck soils, produced primarily in the northeastern United States, valid 1996. American Potato Journal 8:121. 1933.|net necrosis caused by pea leaf roll virus; immune to PVX.|USDA 40568 x USDA 24642.
Chisago|Minnesota Agric. Expt. Sta., Saint Paul, Minnesota.||early, round white, excellent tuber type.||widely for early maturity. American Potato Journal 26:264-269, 1949.||Irish Cobbler x MN13-1 [Russet Burbank 66-1 (Katahdin selfed)].
Coastal Chip (B9792-157)|Haynes et al., USDA, Rutgers University, Correll University.||not in production; medium yield of oval, white tubers; medium-late maturity, good for chips, medium tuber solids, short-medium dormancy.||mid Atlantic United States. American Potato Journal 69:515. 1990.|PVA, golden nematode, heat necrosis.|Wauseon x B5141-6 (Lenape).
Coastal Russet (B9596-2)|Sieczka, Webb, Wilson, Cornell University, USDA, University Florida.||high yield of long, russet tubers; medium maturity, good for tablestock, low tuber solids, short-medium dormancy.|||net necrosis caused by pea leaf roll virus, common scab. Produce primarily in Atlantic Canada, northeastern United States, valid 1996. American Potato Journal 65:407. 1988.|Russet Burbank x B8281-5.
Columbia Russet|Scott, private.||not in production; medium-high yield of oblong, russet tubers; early-medium maturity.|||common scab. USDA Circ. 741, 1946. 19. 19.|open pollinated seedling of Wee McGregor.
Conchita|Rockefeller Foundation, Mexico City, Mexico.|Rockefeller Foundation, Mexico City, Mexico.|medium maturity, tubers white skinned and yellow fleshed, oblong.||central Mexico, 1959.|high field resistance to late blight.|seedling from self pollination of a selection of USDA Acc. 25953 x USDA Acc. 25959.
Conestoga (G712-1)|Johnston et al., Ag. Canada, University Guelph.||medium yield of oblong, white tubers, very early maturity, good for tablestock, chips, medium tuber solids.||produced primarily in the upper midwest of the United States, the prairie provinces of Canada, valid 1996. American Potato Journal 60:193. 1982.|net necrosis caused by pea leaf roll virus, common scab.|G7063 x G6652.
Cortland (NY DFC-1)|Reddick, Cornell.||medium yield of oblong, white tubers; medium maturity, good for tablestock.|||late blight, R-gene. Extinct. American Potato Journal 27:1. 1947.|Unnamed seedling x Menominee.
Crystal (ND8891-3)|Johansen, North Dakota St. University.||not in production; medium yield of oval, white tubers; medium maturity, good for chips, medium tuber solids.|||PVX, common scab. American Potato Journal 59:131. 1980.|Cascade x ND7196-18.
Cupids|Proudfoot, Ag. Canada, Newfoundland.||not in production; high yield of oval, lightly russetted tubers with light yellow flesh; medium-late maturity, good for tablestock, medium tuber solids.|||golden nematode. Potato Varieties in Canada, 1991. New Brunswick Department of Agric. 1986.|N150-3 x Wauseon.
Dakchip (ND8888-2)|Johansen et al., North Dakota St. University.||not in production; medium-high yield of round, white tubers; medium maturity, good for chips, medium tuber solids, short dormancy.|||late blight, R-gene. American Potato Journal 57:567. 1979.|Cascade x Norchip.
Dakota Chief (Red Pontiac)|H.D. Long and Son, Park River, North Dakota.|H.D. Long and Son, Park River, North Dakota.|redder tuber skin than Triumph or Pontiac.|Pontiac.|most potato areas, 1947.|drought.|sport out of Pontiac 1941-2.
Dazoc|Hort. Department, University of Nebraska, Agric. Expt. Sta., Lincoln.|Hort. Department, University of Nebraska, Agric. Expt. Sta., Lincoln.|dark red, very early tubers, smoother and of better culinary quality than Red Warba; commercially accepted in irrigated areas of central Nebraska. National Potato Breeding 23 Annual Report p.161. 1953.||||Triumph (Nebraska Str. 22) x Nebraska 49.40-3 (Minnesota 5-10-3-23-2 x Minnesota 29.32-1-3-4).
Delta Gold (USDA 47156)|Reeves, Webb, USDA, University Maine.||not in production; high yield of round, white tubers with yellow flesh; medium-late maturity, good for tablestock, medium tuber solids, short dormancy.|||immune to PVA, net necrosis caused by pea leaf roll virus. American Potato Journal 57:429. 1979.|Earlaine x USDA 45208.
Delus (B73-18)|F.J. Stevenson, R.V. Akeley, and E.P. Brasher, USDA, Beltsville, Maryland, and Delaware Agric. Expt. Sta., Newark.||attractive appearance and high solid content.|Katahdin. American Potato Journal 31:410-413, 1954.||late blight.|Mohawk x USDA seedling X96-56.
Denali (AK37-68-19-70)|Dearborn, USDA, University Alaska.||not in production; high yield of oblong, white tubers; late maturity, good for tablestock, chips, high tuber solids, long dormancy.||wide. American Potato Journal 56:373. 1978.||B5141-6 (Lenape) x AK1-62-90-64.
DeSota|Miller, Louisiana State University.||vigorous, upright plants, small leaves, medium early; red to pinkish-red tubers, round with medium deep eyes.|Triumph.|western, mid-western, and southern United States and California. American Potato Journal 25:89-91, 1948.|mild mosaic.|Triumph x Katahdin.
DeSota|Miller, Louisiana State University.||extinct; high yield of oval, early-medium maturity, good for tablestock, vigorous, upright plants, small leaves, red to pinkish-red tubers, round with medium deep eyes.|Triumph.|western, mid-western, and southern United States and California. American Potato Journal 25:89-91. 1944.|PVX.|Triumph x Katahdin.
