Name|Breeder|Vendor|Characteristics|Similar|Adaptation|Resistance|Parentage
Donna (F74123)|Young et al., Ag. Canada, New Brunswick.||not in production; high yield of oblong, white tubers with yellow flesh; medium-late maturity, good for tablestock, medium tuber solids, short dormancy, bred for export.|||PVX, golden nematode, verticillium wilt. American Potato Journal 65:509. 1986.|Raritan x Agitato.
Earlaine|United States Department of Agric.||early, tubers white, smooth, shallow eyed, excellent market quality.||Maine. United States Department of Agric. Circ. 493, 1938.|mild mosaic and net necrosis.|Irish Cobbler x USDA Seedling 43055.
Early Gem (Early Russet)|USDA, Beltsville, Maryland, and released jointly with the University of Idaho and North Dakota Agric. College, Moscow, Idaho, and Fargo, North Dakota, respectively.|USDA, Beltsville, Maryland, and released jointly with the University of Idaho and North Dakota Agric. College, Moscow, Idaho, and Fargo, North Dakota, respectively.|Russet skin, early, generally small vines, three to five tubers per hill, scab resistant.|Russet Burbank.|Idaho, North Dakota, Colorado, and parts of California. American Potato Journal 32:79-85. March, 1955.||Russet Burbank x X96-56 x Russet Burbank.
Early Rose|Bresee.||not in production; medium yield of oblong, light red tubers; early maturity, good for tablestock, medium tuber solids, ancestor of many early cultivars. USDA Circ. 741, 1946. 1867.||||open pollinated seedling of Garnet Chili.
Eide Russet (MN10874)|Lauer, University Minnesota.||not in production; medium yield of oblong, russet tubers; medium maturity, good for tablestock.|||common scab. 1989.|WNC325-1 x Norgold Russet.
Characteristics: high yield of round, white tubers; late maturity, good for tablestock, medium tuber solids.|Adaptation: produced primarily in New York, valid 1996. American Potato Journal 62:653. 1985.|Similar:|Breeder: Thurston, Cornell University.|Resistance: golden nematode, late blight, early blight, verticillium wilt.|peat soils.|Parentage: D29-10 x NY27.|Name: Elba (NY59)
Empire|Cornell University, Ithaca, New York.||late, smooth tubers, large crop.||central and western New York. American Potato Journal 22:357-362, 1945. 1942.|late blight.|Rural New Yorker 2 x Azk 3. Azk. 3-Solanum demissum derivative.
Eramosa (F72217)|Coffin et al., Ag. Canada, Ontario.||high yield of oblong, white tubers; early maturity, good for tablestock, low tuber solids.||produced primarily in Atlantic Canada, valid 1996. American Potato Journal 66:293. 1987.|common scab.|F52047 x F60019.
Erendira|USDA, Beltsville, Maryland.|USDA and Rockefeller Foundation, Mexico City, Mexico.|round to oval tubers, white skinned, pale streaks of pink through white flesh.||central Mexico. American Potato Journal 36:300, 1959.|high field resistance to late blight.|USDA Acc. 24891 x USDA seedling X527-170.
Erie|Ohio Agric. Expt. Sta., Wooster.|T.B. Buell.|now grown only in limited area in Pennsylvania; similar to Katahdin in maturity and shape, but not in anthocyanin pigment. American Potato Journal 22:29-32, 1945.|Teton.|||received from USDA as Seedling 47101 from cross of 45146 x Earlaine.
Erik (MN4536)|Lauer, University Minnesota.||not in production; high yield of oblong, red tubers; early maturity, good for tablestock, low tuber solids.|||late blight, verticillium wilt. Potato Varieties in Canada, 1991, New Brunswick Department of Agric. 1983.|ND4524-7R x ND4620-1.
Erli-Red (MN50.4-52-40)|Ben Picha, Grand Forks, N.D.||extinct; medium yield of round, dark red tubers; early maturity, low tuber solids, free from knobs, hollow heart growth cracks and oversize.|Bounty.|northern states of the United States. American Potato Journal 38:78. 1960.|black-spot, air checking and abrasion, internal defects.|MN43.23-6 x MN43.17-16.
Essex|Cornell University, Ithaca, New York.||high yield, midseason to late in maturity.||northeastern United States. American Potato Journal 27:1-10, 1950. 1946.|late blight, and some field resistance to leafroll.|NY ABX-6 x Redd 1152, F2, Triumph. ABX-6-Solanum demissum derivative.
Excel (Nebraska 82 49-1X)|Werner, University Nebraska.||extinct; medium yield of oblong, red tubers; medium-early maturity, good for tablestock. National Potato Germplasm Report 28:127. 1957.||||Nebraska 143.47-16 x Nebraska 59.41-P1.
Fillmore|Cornell University, Ithaca, New York.||plants slow to emerge; large plants with rogose leaflets; terminal leaves purplish tinged; tubers with pinkish blush.||central and western New York. American Potato Journal 27:1-10, 1950.|late blight; tolerance to drought.|Rural New Yorker 2 x NY Azk-3 Sib of Empire.
Frontier Russet (A74114-4)|Pavek et al., USDA, University Idaho, others.||medium yield of oblong, russet tubers; medium maturity, good for tablestock, french fries, medium tuber solids, long dormancy.||produced primarily in the western United States, Atlantic Canada, valid 1996. American Potato Journal 68:525. 1990.|verticillium wilt, fusarium tuber rot, common scab.|A66102-16 x WN330-1.
Fundy|Canadian Department of Agric. Fredericton, N.B, Canada.|Canadian Department of Agric. Fredericton, N.B, Canada.|midseason, white tubers with good appearance, excellent cooking and baking quality.||northern potato growing areas. American Potato Journal 37: 274-277, 1960.|late blight (R1 gene) and virus A.|Keswick x USDA seedling X96-56.
Garnet Chili|Goodrich, private.||not in production; medium yield of oblong, light red tubers; late maturity, good for tablestock, important ancestor of many North American cultivars. USDA Circ. 741, 1946. 1953.||||open pollinated seedling of Rough Purple Chili.
Gemchip (BR7093-24)|Pavek et al., USDA, University Idaho, others.||high yield of oval, white tubers; late maturity, good for chips, medium tuber solids, medium dormancy.||produced primarily in the western United States, valid 1996. American Potato Journal 68:461. 1989.|verticillium wilt, fusarium tuber rot, net necrosis caused by pea leaf roll virus.|BR5960-9 x ND5737-3.
Genesee (NY78)|Plaisted, Cornell University.||high yield of round, white tubers; late maturity, good for tablestock, low tuber solids.||produced primarily in New York, valid 1996. American Potato Journal 70:897. 1993.|golden nematode, verticillium wilt.|M348-45 x Katahdin.
Glenmeer|Cornell University, Ithaca, New York.||high yield, very late in maturity, red tubers.||central New York. American Potato Journal 27:1-10, 1950. 1946.|late blight.|NY ABX-6 x Redd 1152 (F2), Triumph, ABX-3-Solanum demissum derivative.
Golden|Clark, USDA.||extinct; medium-high yield of round, white tubers with yellow flesh; late maturity, good for tablestock. American Potato Journal 8:121. 1935.||||USDA 43106 x USDA 43543.
Goldrus (B8972-1)|Webb et al., USDA, others.||not in production; medium yield of oblong, heavily russetted tubers; early-medium maturity, good for tablestock. 1984.||||B7583-19 x B7160-4.
Goldrush (ND1538-1Russ)|Johansen et al., North Dakota State University.||medium-high yield of oblong, russet tubers; medium maturity, good for tablestock, french fries, medium tuber solids, medium dormancy.||produced primarily in the midwestern, western United States, valid 1996. American Potato Journal 71:809. 1992.|common scab.|ND450-3Russ x Lemhi Russet.
Grand Falls (F5609)|Young, Ag Canada, New Brunswick.||not in production; high yield of oblong, white tubers; medium-late maturity, good for starch, high tuber solids.|||fusarium tuber rot, sambucinum. American Potato Journal 43:323. 1965.|F48034 x SSRPB1682C (1).
Green Mountain|Alexander, University Vermont.||high yield of oblong, white tubers; late maturity, good for tablestock, high tuber solids, long dormancy.||produced primarily in the northeastern United States, Atlantic Canada, valid 1996. USDA Circ. 741, 1946. 1985.|fusarium tuber rot, blackleg, verticillium wilt.|Excelsior x Dunmore.
Haig (Nebraska 223.48-1X)|Werner, University Nebraska.||not in production; medium yield of oblong, white tubers; very early maturity, good for tablestock, low tuber solids.|||PVX, common scab. National Potato Germplasm Report 28:128. 1957.|Cayuga x MN43.39-6-40.
Hampton (Q54-15)|Plaisted, Cornell University.||high yield of round, white tubers; late maturity, good for tablestock, medium tuber solids.||produced primarily in New York, valid 1996. American Potato Journal 62:455. 1985.|golden nematode, verticillium wilt.|NY48 x NY51.
Harford (NY CSF-11)|Reddick, Cornell University.||extinct; high yield of oval, white tubers; late maturity, good for tablestock.|||late blight, R-gene. American Potato Journal 27:8. 1947.|Russet Rural x NY AFY15.
Highlat Russet (B8934-2)|Dearborn, USDA, University Alaska.||not in production; high yield of oblong, russet tubers; late maturity, good for tablestock, medium tuber solids. American Potato Journal 58:177. 1980.||||B7680-6 x B7196-25.
HiLite Russet (78-LCI)|Loosli, private.||medium yield of oblong, russet tubers; early maturity, good for tablestock, medium tuber solids, long dormancy.||produced primarily in Atlantic Canada. Potato Varieties in Canada, 1991. New Brunswick Department of Agric. 1987.|net necrosis caused by pea leaf roll virus, common scab, hollow heart.|uncertain possibly Nooksack x Norgold Russet.
Hi-Plains (Nebraska 302.50-5)|OKeefe, University Nebraska.||extinct; medium-high yield of oblong, lightly russetted tubers; medium-late maturity, good for tablestock, chips, low tuber solids.|||common scab. American Potato Journal 42:361. 1965.|USDA X528-170 x Kasota.
Houma|United States Department of Agric.||white, high yielding, good quality, market and cooking.||New England and New York. US Department of Agric. Circ. 420, 1936.|mild mosaic, net necrosis, leaf roll.|Charles Downing x Katahdin.
Hudson (NY41)|Plaisted, Cornell University.||not in production; very high yield of oblong, white tubers; late maturity, good for tablestock, medium tuber solids.|||golden nematode. American Potato Journal 50:212. 1972.|NIF-1 x 56N18-4.
Hunter (F5350)|Davies et al., Ag. Canada, New Brunswick.||not in production; high yield of oval, white tubers; medium-late maturity, good for tablestock, medium tuber solids.|||late blight, R-gene, blackleg, verticillium wilt, corky ringspot; immune to PVX, PVA. American Potato Journal 40:275. 1961.|F4823 x SSRBP834C (29).
Huron (F1711-9)|Johnston et al., Ag. Canada, New Brunswick.||not in production; high yield of round, white tubers; late maturity, good for tablestock, medium tuber solids.|||common scab. American Potato Journal 35:715. 1958.|Hindenburg x Sebago.
Idita Red (AK18-69-6-71)|Carling, University Alaska.||not in production; high yield of oblong, red tubers with yellow flesh; early maturity, good for tablestock, low tuber solids, long dormancy. American Potato Journal 66:741. 1989.||||Rode Errsteling x Red Beauty.
Irish Cobbler|private.||high yield of round, white tubers with deep eyes, early maturity, good for tablestock, low tuber solids, short dormancy, the predominant cultivar in Japan, known as Danshakuimo, valid 1996.||produced primarily in the upper midwest of the United States. USDA Circ. 741, 1946.|PVA.|
Islander (AF186-5)|Reeves, Akeley, others, University Maine.||not in production; high yield of oblong, white tubers; medium maturity, good for tablestock, chips, medium tuber solids.|||golden nematode, common scab, early blight, net necrosis caused by pea leaf roll virus. American Potato Journal 61:543. 1984.|Chipbelle x Norchip.
Itasca (MN12567)|Lauer, University Minnesota.||high yield of round, white tubers; late maturity, good for tablestock and chips, medium tuber solids.||produced primarily in the upper midwest of the United States, valid 1996. 1994.|common scab.|MN304.72-10 x ND58-3.
Jemseg (F67072)|Young et al., Ag. Canada, New Brunswick.||medium yield of oblong, white tubers; early maturity, good for tablestock, medium tuber solids.||produced primarily in Atlantic Canada, valid 1996. American Potato Journal 56:325. 1978.|common scab.|Sable x F55069.
Jersey Redskin|USDA.|University of Tenn.|a fall potato University of Tenn. Bul. 148, 1933.||||
Jewel (121P)|Pratt, private.||extinct; medium-high yield of oval, white tubers; medium-late maturity, good for chips. American Potato Journal 46:83. 1969.||||Sebago x Stately.
K N I K|Alaska Expt. Sta., Palmer.|Alaska Certified Seed Growers.|smooth skin, shallow eye, high yield, large, long, oval, solid tubers.||Alaska. American Potato Journal 30:148-149, 1953.||Arctic Seedling Green Mt. x MN56-1.
Kanona (NY71)|Plaisted, Cornell University.||high yield of round, white tubers; late maturity, good for chips and tablestock, medium tuber solids, medium dormancy.||produced primarily in the northeastern United States and Atlantic Canada, valid 1996. American Potato Journal 66:145. 1988.|golden nematode.|Peconic x GN bulk pollen.
Kasota|Minnesota Agric. Expt. Sta., Saint Paul.||medium early, red tubers, maintains tuber type under wide range of conditions.||on heavier silt loam soils. American Potato Journal 20:25-27, 1943.||Bliss Triumph x Selection 29-13.
Katahdin (USDA 42667)|Clark, USDA.||high yield of round, white tubers; late maturity, good for tablestock, medium tuber solids, medium dormancy, historically the standard for round, white fresh market production.||produced primarily in the northeastern United States, Atlantic Canada, valid 1996. American Potato Journal 8:121. 1932.|PVA, PVX, PVY, net necrosis caused by pea leaf roll virus.|USDA 40568 x USDA 24642.
Kennebec|USDA.||white, high yield, tubers elliptical to oblong, eyes shallow, good quality.||northern United States. American Potato Journal 25:351-361, 1948.|late blight, mild mosaic and net necrosis.|USDA B127 x X96-56.
Keswick|Canadian Dominion Expt. Sta., Fredericton, New Brunswick, Canada.|Experimental Farm.|high starch content, tendency to grow oversize on rich soils.|Chippewa.|eastern Canada. American Potato Journal 28:698-699, 1951. 1951.|common races of late blight.|F1020-1 (Solanum demissum x Earlaine x Earlaine x Earlaine) x Green Mountain.
Krantz (MN9648)|Lauer, Miller, others, University Minnesota, Texas A and M University.||medium yield of oblong, russet tubers; medium maturity, good for tablestock, french fries, medium solids, short dormancy.||produced primarily in the northeastern United States, Atlantic Canada, valid 1996. American Potato Journal 65:387. 1985.|common scab, hollow heart, verticillium wilt, late blight.|MN366.65-3 x G6743-5.
LaBelle (LA01-38)|Fontenot, Louisiana State University.||high yield of oblong, white tubers; medium-late maturity, good for tablestock, chips, low tuber solids, medium dormancy.||produced primarily in Nebraska, valid 1996. American Potato Journal 68:13. 1989.|hollow heart, heat necrosis.|B5461-4 x B5141-6 (Lenape).
LaChipper (L91-78)|Miller et al., Louisiana State University.||high yield of round, white tubers; medium maturity, good for tablestock, chips, medium tuber solids.||produced primarily in the upper midwest, northeastern regions of the United States, valid 1996. American Potato Journal 40:130. 1962.|late blight.|Cayuga x Green Mountain.
Lake|USDA.||extinct. 1945.||||Richters Jubel x USDA 44537.
Langlade (W718)|Peloquin, University Wisconsin.||high yield of round, white tubers; medium maturity, good for tablestock, medium tuber solids.||produced primarily in the upper midwest, northeastern regions of the United States, valid 1996. Potato Varieties in Canada, 1991. New Brunswick Department of Agric. 1985.|common scab.|Kennebec x W631.
LaRouge (L42-45)|Miller et al., Louisiana State University.||high yield of round, red tubers; medium-late maturity, good for tablestock, low tuber solids.||produced primarily in the upper midwest of the United States, valid 1996. American Potato Journal 40:130. 1962.|common scab.|LA02-5 x LA02-5.
LaSalle|Miller, Louisiana State University.||extinct; high yield of oval, white tubers; early-medium maturity, good for tablestock, medium vigorous and upright plants; tubers white, semi-flat, slightly oblong, shallow eyes.|Katahdin.|Virginia and Maryland. American Potato Journal 25:89-91, 1948. 1948.|PVX.|Chippewa x inbred seedling of Triumph.
LaSoda|Miller, Louisiana State University.||not in production; high yield of oblong, white tubers; medium maturity, good for tablestock, medium tuber solids, medium dormancy, red skinned mutant of this cultivar, named Red LaSoda, has replaced it in commerce; medium-vigorous plant, upright, medium leaves; bright pinkish-red tubers semi-round to slightly oblong; medium to shallow eyes.|Pontiac.|all potato growing areas. American Potato Journal 25:89-91, 1948. 1948.|mosaic.|Triumph x Katahdin.
Lemhi Russet (A68678-1)|Pavek et al., USDA, University Idaho.||not in production; high yield of long, russet tubers; late maturity, good for tablestock, french fries, high tuber solids, short dormancy.|||common scab, net necrosis caused by pea leaf roll virus. American Potato Journal 58:619. 1981.|Pioneer x A63126-8.
Lenape (B5141-6)|Akeley et al., USDA, Pennsylvania State University.||not in production; medium yield of round, white, flattened tubers; medium maturity, good for chipping, high tuber solids, short dormancy, release rescinded due to high glycoalkaloid content in tubers.|||late blight, R-gene, PVX, net necrosis caused by pea leaf roll virus. American Potato Journal 45:142. 1967.|Delta Gold x B3672-3.
Madison|Cornell University, Ithaca, New York.||determinate growth, yield equals Katahdin, tendency for tubers to hollow-heart.||central New York. American Potato Journal 27:1-10, 1950. 1947.|late blight.|Earlaine x AMY-4, AMY-4-Solanum demissum derivative.
Mainechip (AF875-16)|Reeves et al., University Maine.||medium yield of round, white tubers; medium maturity, good for chips, tablestock, high tuber solids, medium dormancy.||produced primarily in Maine, New Brunswick, valid 1996. American Potato Journal 71:237. 1991.|net necrosis caused by pea leaf roll virus.|AF186-2 x AF84-4.
Mainestay (AF1060-2)|Reeves et al., University Maine.||high yield of round, white tubers; medium-late maturity, good for tablestock.||produced primarily in Maine, valid 1996. 1995.|net necrosis caused by pea leaf roll virus.|AF431-9 x AF431-9.
Manota|North Dakota Agric. Expt. Sta., Fargo.|University of Manitoba.|shallow eyed, smooth, slightly flattened and elongated.|Cobbler.|northern central United States and prairie provinces of Canada. American Potato Journal 30:50-52, 1953.||Minnesota 11-1-2-1 (Early Ohio, Keeper, and Silverskin) x Minnesota 9-4 (Warba and Katahdin).
Marygold|USDA and the University of Maryland, College Park.|W. Deberry, Oakland, Maryland.|yellow flesh, smooth, high yield, responds to chemical treatment for breaking rest period.||Coastal Plain. American Potato Journal 26:2532, 1949. 1949.||Earlaine x USDA 45208.
Mason|Warren Mason, Berlin, Philadelphia.||was principal cultivar in Somerset County, but became infected with leaf roll, obsolete.|other White Rural selections. 1940.|||a white sport selected from Russet Rural.
Maverick|Reeves, University Maine.||not in production; high yield of oblong, lightly russetted tubers; medium maturity, good for tablestock, low tuber solids, medium dormancy.|||common scab, acid scab, silver scurf, net necrosis caused by pea leaf roll virus, late blight, R-gene, PVX. Potato Varieties in Canada, 1991, New Brunswick Department of Agric. 1986.|B6330-3 x A6334-20.
McCormick|McCormick, private.||extinct, late maturity.|||wart. USDA Circ. 741, 1946. 1982.|
Menominee|Michigan State College, East Lansing, and the USDA.|Certified Seed Growers.|high yield, white skin, tendency toward resetting, cubical tubers, eyes medium deep.||north central region. American Potato Journal November, 1944.|scab, late blight, and mild mosaic.|Richters Jubel x Seedling 44537.
Merrimack (B355-44)|USDA, Beltsville, Maryland, and New Hampshire Agric. Expt. Sta., Durham.|Colby Brothers.|||general, except in north. American Potato Journal 32:3 March, 1955.|high to late blight and ring rot.|Saranac x X96-56.
Mesaba|Minnesota Agric. Expt. Sta., Saint Paul.||early, smooth, rural type tubers, upright productive vine.||short seasons and peat lands. American Potato Journal 15(4):89-91, 1938.||Russet Rural x Set. 41-1.
Michibonne (MS709)|Thompson, Michigan State University.||extinct. 1977.||||IA902-3 x IA872-4.
Michigami|Thompson, Michigan State University.||extinct. 1977.||||IA90 x Emmet.
Michigold (MS704-10Y)|Chase et al., Michigan State University.||not in production; medium yield of round, white tubers with yellow flesh; medium maturity, good for tablestock, medium tuber solids, short dormancy.|||early blight. American Potato Journal 69:629. 1988.|Atlantic x bulk pollen.
Michimac|Thompson, Michigan State University.||not in production. 1977.||||IA902-3 x Emmet.
Mirton Pearl (N135-55)|Proudfoot, Ag. Canada, Newfoundland.||not in production; very high yield of oblong, white tubers with deep eyes, medium maturity, good for tablestock, medium-high tuber solids.|||moderate to late blight. Potato Varieties in Canada, 1991. New Brunswick Department of Agric. 1975.|Mira x F53018.
Mohawk|Cornell University, Ithaca, New York, and the USDA.||tubers flattened oblong, eyes shallow, skin white flaked; excellent cooking quality.||New England and New York. American Potato Journal, April, 1943.|mild mosaic.|Green Mountain x Katahdin.
Monona (B3620-1)|Stevenson et al., USDA, Frito-Lay.||medium yield of oblong, white tubers; medium maturity, good for chips, low tuber solids.||produced throughout the United States, Canada, valid 1996. American Potato Journal 42:253. 1964.|PVY, PVA.|B1268-46 x B1299-15.
Mouraska (LP8058)|Freve, Ag. Canada, Quebec.||high yield of oblong, white tubers; early-medium maturity, good for tablestock, early chipping, low tuber solids.||produced primarily in Quebec, valid 1996. Potato Varieties in Canada, 1991, New Brunswick Department of Agric. 1990.||Hudson x F59103.
Nampa (A63126-2)|Pavek et al., USDA, University Idaho.||not in production; high yield of oblong, russet tubers; late maturity, good for tablestock, french fries, medium tuber solids, medium dormancy.|||common scab, net necrosis caused by pea leaf roll virus, hollow heart, storage rots. American Potato Journal 50:296. 1973.|A589-65 x Norgold Russet.
Navajo|USDA, Greeley, Colorado.|USDA and Colorado Agric. Expt. Sta., Ft. Collins, Colorado.|good yield, high cooking and chipping quality, medium maturity, smooth white skin with shallow eyes.|Katahdin.|Colorado, 1958.|scab and common race of late blight.|USDA seedling X627-126 x USDA seedling B 929-32.
Nemarus (B9540-62)|Goth et al., USDA.||not in production; high yield of oblong, russet tubers; medium-late maturity, good for tablestock, low tuber solids, medium dormancy.|||golden nematode, PVX, net necrosis caused by pea leaf roll virus, fusarium tuber rot. American Potato Journal 66:703. 1985.|B7160-4 x B7610-1.
Nipigon (F60051)|Johnston et al., Ag. Canada, Ontario.||not in production; high yield of oblong, white tubers; late maturity, good for tablestock, medium tuber solids.|||PVX, PVY, late blight, R-gene. American Potato Journal 55:107. 1976.|F53026 x F51043.
Niska (W848)|Lynch et al., Ag. Canada, Alberta, University Wisconsin.||medium yield of oval, white tubers; late maturity, good for chips, tablestock, high tuber solids, medium dormancy.||produced primarily in Atlantic Canada, valid 1996. American Potato Journal 68:143. 1991.|common scab, PVS.|Wischip x B5141-6 (Lenape).
Nooksack (WN168)|Hoyman and Holland, USDA.||medium yield of oblong, flat, russet tubers; late maturity, good for french fries, tablestock, high tuber solids, very long dormancy.||produced primarily in the western United States, valid 1996. American Potato Journal 51:99. 1973.|verticillium wilt, net necrosis caused by pea leaf roll virus, common scab.|Kennebec x A501-13.
Norchief (ND5778-2R)|Johansen et al., North Dakota State University.||not in production; high yield of round, dark red tubers; early-medium maturity, good for tablestock, medium tuber solids.|||common scab. American Potato Journal 46:298. 1968.|ND4468-1R x Redkote.
Norchip (ND5899-1)|Johansen et al., North Dakota State University.||medium yield of round, white tubers; medium maturity, good for chips, tablestock, medium tuber solids, short dormancy, predominant chipping cultivar in North America until about 1990.||produced throughout the United States, Canada. American Potato Journal 46:254. 1968.||ND4731-1 x M5009-2.
Nordak (ND457-1-10)|Johansen et al., North Dakota State University.||not in production; medium yield of oblong, white tubers; early maturity, good for tablestock, chips, medium tuber solids.|||PVY. American Potato Journal 35:774. 1957.|ND457-1 x ND457-1.
NorDonna (ND1871-3R)|Johansen et al., North Dakota State University.||medium yield of round, dark red tubers; medium maturity, good for tablestock, low tuber solids, medium dormancy.||produced primarily in the upper midwest of the United States, valid 1996. 1995.||ND206-1R x ND821-6R.
Norgleam (ND457-1-16)|Johansen et al., North Dakota State University.||not in production; high yield of oblong, white tubers; early maturity, good for tablestock, chips, medium tuber solids.|||PVY. American Potato Journal 35:774. 1957.|ND457-1 x ND457-1.
Norgold Russet|Johansen, North Dakota State University.||medium-high yield of oblong, russet tubers; early maturity, good for tablestock, medium tuber solids, short dormancy, predominant early tablestock, russet cultivar in the United States until about 1985.|Russet Burbank.|produced primarily in Texas, 1996. American Potato Journal 47:201. 1964.|scab.|A119-1 x ND2475-8.
