Name|Breeder|Vendor|Characteristics|Similar|Adaptation|Resistance|Parentage
Burpee's Peppy Hybrid|W. Atlee Burpee Co., Philadelphia.|W. Atlee Burpee Co., Philadelphia.|F1 hybrid, early, two or three ears per stalk, white pointed and hulless kernels.|Minhybrid.|wide. Burpee catalog. 1958.||
Carnival|Univ. of New Hampshire, Durham.|Billy Hepler Seed Co.|early, kernels pink, red, black, white, and yellow of good popping quality.|Popinjay.|northern United States. N.H. Agr. Expt. Sta. Bul. 380:19. 1950.||Popinjay x Golden Tom Thumb.
Eastern Sunburst|Eastern States Farmers' Exchange, West Springfield, Mass.|Eastern States Farmers' Exchange, West Springfield, Mass.|open-pollinated yellow with good standability.||northern New England. E.S. catalog. 1957.||cross of Yellow Pearl types from two sources.
Fireside|New Hampshire Agr. Expt. Sta., Durham, N.H.||early, dwarf plants, with two mahogany red or golden ears.||general.||Tom Thumb x Strawberry.
Popinjay|Univ. of New Hampshire, Durham.|Colprit's Nursery.|early, with variegated pink, black, and white kernels of good popping quality.||northern United States. N.H. Agr. Expt. Sta. Bul. 380:18. 1950.||Pinky x New Hampshire Pearl.
